"Rating","Date","Title","Content","Reviewer","Verified","Brand Response"
"5","","","","","No",""
"5","06/10/2023","Très satisfait","Cette cartable est du très bon qualité avec son prix qu’il est parfait","Gumeri, Tunisia","Yes","Bonjour Mr.Gumeri,  Nous vous remercions chaleureusement pour votre avis positif !  Nous sommes ravis d'apprendre que vous trouvez votre produit d'un bon rapport qualité-prix et que le Sac à dos s'est avéré efficace et pratique pour vous. La satisfaction de nos clients est notre priorité et il est encourageant de voir que notre produit répond à vos besoins. Votre retour est précieux pour nous et nous espérons avoir l'opportunité de vous servir à nouveau dans le futur.  Encore merci pour votre confiance en notre produit !  Bonne journée !  Rawen Conseillère Service Client"
"4","06/10/2023","Bon achat","Produit pas mal","Nul, Tunisia","Yes","Bonjour Badis,  Merci infiniment pour votre retour positif  Nous sommes ravis que vous ayez apprécié notre produit.  Bonne journée :)  Rawen Conseillère Service Client"
"4","06/09/2023","Sac à dos","Pratique léger","Hayfa, Tunisia","Yes","Bonjour Haifa, Je vous remercie pour votre avis C'est gratifiant de voir que notre produit répond à vos besoins et vous satisfait. Excellente journée à vous  Sportivement Hassine Conseiller Service Client"
"5","17/04/2023","trés bon produit","très bon produit","Habib, Tunisia","Yes","Bonjour, je vous remercie pour votre avis et pour cette super note 🙂 c'est un plaisir de lire votre satisfaction.  Meriam Sportif satisfait c'est mon métier"
"4","26/01/2023","Bon produit","Je recommande","Abdelhalim, Tunisia","Yes","Bonjour, Merci pour ce retour au TOP, vous êtes génial! Je suis ravie que votre expèrience s’est bien passée comme vous l’avez souhaité  Meriam Sportif satisfait c'est mon métier"
"5","31/10/2022","Ok","Good job","Walid, Tunisia","Yes","bonjour  Nous sommes fiers de votre avis , car votre satisfaction est notre première priorité .    meriam :) Sportifs satisfaits c'est mon métier"
"5","24/10/2022","Décathlon le meilleur en produits sportif","Design et dureté incomparable","Guesmi, Tunisia","Yes","bonjour  Merci pour votre avis. je suis content que vous êtes satisfait.    meriam :) Sportifs satisfaits c'est mon métier"
"4","16/05/2025","N/A","Bom produto.","Rui, Portugal","Yes","No response"
"4","16/05/2025","N/A","Snelle levering en prima product","Peter, Netherlands","Yes","No response"
"5","16/05/2025","N/A","Fazla gözü yok ancak fiyat olarak çok iyi. İş görüyor, 20lt yakın kapasitesi var, hafif. Günlük kullanım için veya 1 günlük seyahat için yeterli.","Yasin, Türkiye","Yes","No response"
"5","16/05/2025","N/A","High quality affordable price","Khairudin, Singapore","Yes","No response"
"3","16/05/2025","N/A","Quality Ok, material is kind of thin.","Boon hshin, Singapore","Yes","No response"
"5","16/05/2025","N/A","très bon produit et très confortable et ace grand comme sac a dos","mickael, France","Yes","No response"
"5","16/05/2025","N/A","Nice bag","Lizza, Singapore","Yes","No response"
"5","15/05/2025","N/A","Ottimo acquisto","Raffaella, Italy","Yes","No response"
"4","15/05/2025","N/A","Amazing bag very comfy","Carlton, India","Yes","No response"
"4","14/05/2025","N/A","Per il prezzo pagato, veramente ottimo","LUCA, Italy","Yes","No response"
"5","14/05/2025","Mükemmel","Urun cok guzel","Rıza, Türkiye","Yes","No response"
"5","14/05/2025","çanta","Çanta kullanışlı, taşınması ve kapasitesi gayet iyi. Decathlon kalitesi, teşekkürler.","Şerif, Türkiye","Yes","No response"
"4","14/05/2025","N/A","Pour utiliser des voyages en avion pour des cours séjours simple parfait","MICHEL, France","Yes","No response"
"5","14/05/2025","N/A","Ottimo zaino di taglia media, possibilità di personalizzazione","Eleonora, Italy","Yes","No response"
"5","14/05/2025","N/A","Daha öncesinde de kullandığım bir ürün. Çok işime yaradı.","Nazlı, Türkiye","Yes","No response"
"5","13/05/2025","Dobrej jakości plecak","Plecak używany przez męża do pracy.","Ewa, Poland","Yes","No response"
"5","13/05/2025","N/A","Le sac à dos parfait, sobre, pratique, élégant, le compartiment à ordinateur à l'intérieur est bien pratique. Agréable à porter, léger. La place extérieure pour la bouteille d'eau, nickel. Et surtout, le prix imbattable. Je recommande.","JR, France","Yes","No response"
"5","13/05/2025","N/A","Comodissimo","colletti, Italy","Yes","No response"
"4","13/05/2025","N/A","RAPPORT QUALITE PRIX IMBATTABLE","DAVID, France","Yes","No response"
"5","13/05/2025","N/A","Utazáshoz választottuk. A reptéren nem ""szórakoztak vele"". Pont jó méret!","András, Hungary","Yes","No response"
"5","13/05/2025","Super Rucksack für kleine Leute","Ich habe einen Rucksack mit um die 15L Fassungsvermögen gesucht, den man auch als persönlichen Gesgenstand mit ins Flugzeug nehmen kann. Dafür ist er perfekt geeignet. Viel Stauraum und sehr leicht!","Viktoria, Austria","Yes","No response"
"3","12/05/2025","N/A","Buon prodotto per qualità e prezzo","Lorenzo, Italy","Yes","No response"
"5","12/05/2025","N/A","Çok iyi.","Şerif, Türkiye","Yes","No response"
"4","12/05/2025","N/A","Ottimo qualità prezzo","Fran, Italy","Yes","No response"
"3","12/05/2025","N/A","Prodotto economico ma molto utile","Serena, Italy","Yes","No response"
"5","12/05/2025","N/A","Polecam","Jolanta, Poland","Yes","No response"
"5","12/05/2025","Handy and durable","Loves it.. Comes with 10 years warranty","Duljit, India","Yes","No response"
"5","10/05/2025","N/A","Confortable","Benoît, France","Yes","No response"
"5","10/05/2025","N/A","For the price. It's worth it.","Rhys, Spain","Yes","No response"
"4","10/05/2025","N/A","Muy cómoda y chula","miquel, Spain","Yes","No response"
"5","09/05/2025","N/A","Excelent pentru nevoile mele.","eduard, Romania","Yes","No response"
"5","09/05/2025","N/A","Very Nice","Kapil, India","Yes","No response"
"5","09/05/2025","N/A","Poręczny.","Mirosława, Poland","Yes","No response"
"5","09/05/2025","Zaino","Zaino basic con una seconda tasca davanti.","Fraschini, Italy","Yes","No response"
"5","08/05/2025","N/A","Fait le taf","DANY, France","Yes","No response"
"5","08/05/2025","plecak","Super wygodny i pojemny","Grzegorz, Poland","Yes","No response"
"5","08/05/2025","Plecak 17l","Super plecaczek na co dzień i na krótkie wycieczki. Stosunek jakości do ceny 100/10. Polecam!","Wojciech, Poland","Yes","No response"
"5","08/05/2025","N/A","Qualità prezzo top! lo uso tutti i giorni per andare a lavoro e portarmi dietro i miei oggetti e cibo, lo uso anche in moto!","Maurizio, Italy","Yes","No response"
"5","08/05/2025","mükemmel","mükemmel","Selçuk, Türkiye","Yes","No response"
"5","08/05/2025","N/A","Parasının hakkını son krş kadar veriyor.","Caner, Türkiye","Yes","No response"
"5","07/05/2025","N/A","Muy util y comoda","antonio, Spain","Yes","No response"
"5","07/05/2025","N/A","Good","shobil, India","Yes","No response"
"5","06/05/2025","N/A","buen precio","Mercedes, Spain","Yes","No response"
"4","06/05/2025","N/A","Và bene per piccole gite, e ovviamente se si mettono oggetti pesanti e si fà molta strada non è il massimo (ma non è il suo scopo) ... in ogni modo non costa molto e lo consiglio per il buon rapporto qualità/prezzo","Filippo, Italy","Yes","No response"
"5","06/05/2025","N/A","Perfecta","Su, Spain","Yes","No response"
"5","06/05/2025","N/A","Parfait pour partir en randonnée avec sa poche gourde sur le côté","Jean Luc, France","Yes","No response"
"5","06/05/2025","N/A","Polecam","Damian, Poland","Yes","No response"
"5","05/05/2025","N/A","Ottimo rapporto qualita'/prezzo. Molto bello il colore, maneggevole, resistente, assolutamente indicato per brevi escursioni in bici/a piedi o in alternativa al marsupio come contenitore di chiavi, portafoglio, bottiglietta d'acqua.","Luigi, Italy","Yes","No response"
"1","05/05/2025","N/A","La red portabotellas se me rompió en 3 días","cor, Spain","Yes","No response"
"5","03/05/2025","Bom","Bom produto","Rui, Portugal","Yes","No response"
"5","02/05/2025","N/A","Tanto la atención como el producto, Magnífico todo.","ruth, Spain","Yes","No response"
"4","02/05/2025","N/A","Ürün beklentimin üzerinede çok memnunum.","Cetin, Türkiye","Yes","No response"
"5","30/04/2025","N/A","K","Anca, Romania","Yes","No response"
"5","30/04/2025","N/A","Mindennapos használatra vettem. Pont jó méret. Nem nehéz a súlya.","Éva, Hungary","Yes","No response"
"4","30/04/2025","N/A","Foarte bun, rezistent. Perfect pt. călătoria cu avionul ca bagaj de mână","NARCIS, Romania","Yes","No response"
"5","30/04/2025","Çanta","Küçük ve kullanışlı bir ürün fiyatida uygun ve sağlam bir ürün 2 yıldır kullanıyorum tavsiye ederim ama biraz küçük deneyip görmeden almayın","Naim, Türkiye","Yes","No response"
"5","28/04/2025","N/A","Balo nhỏ gọn nhẹ","Nón bảo hiểm, Vietnam","Yes","No response"
"5","25/04/2025","N/A","Boa muito recomendo","RENATO DOS SANTOS, Portugal","Yes","No response"
"5","25/04/2025","N/A","Simplet et efficace, il est parfait pour prendre l'avion et respecte les dimensions de certaines compagnies aériennes comme Transavia","Michael, France","Yes","No response"
"5","24/04/2025","KULLANIŞLI","Çanta fiyatına göre çok kullanışlı ve rahat, iç hacmi geniş","SİNAN KEMAL, Türkiye","Yes","No response"
"5","23/04/2025","Parfait","Parfait","THOMAS, France","Yes","No response"
"5","23/04/2025","świetny plecak","solidny plecak, chociaż mały to jest pojemny","Patrycja, Poland","Yes","No response"
"4","23/04/2025","N/A","Robust materials","Faizal, Malaysia","Yes","No response"
"5","23/04/2025","N/A","Gia đình tôi đã dùng nhiều sản phẩm của hãng. Các sản phẩm dùng đề ok. Tôi cũng hay giới thiệu với người thân về các sản phẩm của hãng.","Anonymous Author, Vietnam","Yes","No response"
"4","23/04/2025","N/A","Zaino molto comodo e funzionale","Antonio, Italy","Yes","No response"
"5","22/04/2025","Taille idéal","Super bien. Idéal pour les piques nique et le sport","richard, France","Yes","No response"
"5","22/04/2025","Kullanışlı ve sağlam","Ürünü doğa yürüyüşleri için satın aldım deniz havlum yedek şort ve tişörtüm rahat sığıyor su şişesi koyma yeri olması ayrı bir avantaj herkese tavsiye ederim","Barut, Türkiye","Yes","No response"
"3","22/04/2025","N/A","tuyet voi","Anonymous Author, Vietnam","Yes","No response"
"5","22/04/2025","N/A","Nhẹ, tiện lợi, để được nhiều đồ","Anonymous Author, Vietnam","Yes","No response"
"5","22/04/2025","N/A","Rất hài lòng","Anonymous Author, Vietnam","Yes","No response"
"5","21/04/2025","N/A","Ba lô này rất tiện lợi và bền","Anonymous Author, Vietnam","Yes","No response"
"5","21/04/2025","N/A","Xuất sắc","Anonymous Author, Vietnam","Yes","No response"
"4","21/04/2025","N/A","Hài lòng","Anonymous Author, Vietnam","Yes","No response"
"5","20/04/2025","N/A","Cab use daily for casual.","Shah, Malaysia","Yes","No response"
"5","20/04/2025","N/A","Good bag","Ezz, Malaysia","Yes","No response"
"5","20/04/2025","N/A","Good size, and very compatible for daily use and sports use.","Ahmad shahir, Malaysia","Yes","No response"
"5","20/04/2025","N/A","Good product","Ahmad shahir, Malaysia","Yes","No response"
"5","19/04/2025","N/A","Its nice and I take it to gym","Austin, Malaysia","Yes","No response"
"5","18/04/2025","N/A","Sản phẩm đẹp và bền rất Thích","Anonymous Author, Vietnam","Yes","No response"
"5","18/04/2025","N/A","Tôi thấy ok","Anonymous Author, Vietnam","Yes","No response"
"5","18/04/2025","N/A","Bền, đẹp, tiện dụng","Anonymous Author, Vietnam","Yes","No response"
"5","18/04/2025","N/A","Tuyệt đỉnh","Anonymous Author, Vietnam","Yes","No response"
"5","18/04/2025","N/A","Rất thích sản phẩm bên mình .","Anonymous Author, Vietnam","Yes","No response"
"4","17/04/2025","N/A","Sản phẩm tốt đúng như tôi mong đợi dẽ luôn ủng hộ","Anonymous Author, Vietnam","Yes","No response"
"5","16/04/2025","GÜZEL","Çanta çok güzel sadece biraz küçük ama benim için yeterli","Ali Cem, Türkiye","Yes","No response"
"5","16/04/2025","kadın sırt cantasi","gerçekten çok begendim teşekkür ederim","Sahin, Türkiye","Yes","No response"
"5","16/04/2025","szuper","szeretjük","Kinga, Hungary","Yes","No response"
"5","15/04/2025","Polecam","Polecam","Mateusz, Poland","Yes","No response"
"5","14/04/2025","R-A-S","RAS","Hussain, Morocco","Yes","Merci pour votre avis positif ! Bonjour, Nous vous remercions chaleureusement pour votre retour. Votre satisfaction est notre priorité et nous sommes ravis que notre produit ait répondu à vos attentes. Au plaisir de vous retrouver bientôt chez Decathlon. Douaa-L’équipe Decathlon"
"5","14/04/2025","👍","👍","Khalil, Morocco","Yes","No response"
"5","14/04/2025","N/A","Uss for indoor classes","nitish, India","Yes","No response"
"5","14/04/2025","N/A","ok ổn","Danh Khanh, Vietnam","Yes","No response"
"5","14/04/2025","N/A","nhẹ. khá ok. giá ổn","Anonymous Author, Vietnam","Yes","No response"
"5","11/04/2025","Çok kullamışlı","Ürün kullanışlı tavsiye edilir","Ömer Faruk, Türkiye","Yes","No response"
"5","11/04/2025","excelente","excelente","Patrícia, Portugal","Yes","No response"
"5","11/04/2025","N/A","Value for money","Shubham vartak, India","Yes","No response"
"5","11/04/2025","excelente","boa qualidade/preço","Luis, Portugal","Yes","No response"
"4","10/04/2025","Serve","Serve para o que foi concebida e para o preco que cust","André, Portugal","Yes","No response"
"5","10/04/2025","Sac léger bon prix","Sac léger à prix correct qui tient bien sur le dos il me convient parfaitement","REMY, France","Yes","No response"
"5","10/04/2025","mükemmel","her gün kullaniyorum cok dayanıklı","Tolga, Türkiye","Yes","No response"
"4","10/04/2025","f/p ürünü","Ürün aşırı kaliteli değil ancak. seri sonu ürünü olarak aldığım için 17lt bu fiyata çok iyi. Çantanın kumaş ince, sırt kısmı da aynı şekilde. Fermuar başlığı da metal değil ip var sadece","eren, Türkiye","Yes","No response"
"5","10/04/2025","N/A","Mới đeo khoảng thời gian cảm nhận rất thoải mái , ngăn tùy không quá bự nhưng vẫn đủ để đựng những đồ cần thiết. Nói chung là quá xứng đáng với số tiền bỏ ra.","Anonymous Author, Vietnam","Yes","No response"
"5","10/04/2025","N/A","Nice bag","mohd syafiq, Malaysia","Yes","No response"
"5","09/04/2025","zaino","prodotto bem fatto e comodo","Gigantiello , Italy","Yes","No response"
"5","07/04/2025","N/A","Multiple purposes👍","Vaibhav, India","Yes","No response"
"5","06/04/2025","N/A","Ottimo zaino da tempo libero","Eliana, Italy","Yes","No response"
"5","04/04/2025","Perfetto","ottimo","Agostino, Italy","Yes","No response"
"4","04/04/2025","Taşıması kolay ve sağlam","Çantanın taşıması kolay ve sağlam. Gün içindeki yürüyüşler için ideal. Yan tarafındaki su şişesi bölmesi de güzel düşünülmüş. Fakat çamaşır makinesinde yıkayacak olanlar dikkat etmesi gerekiyor. Ön göz fermuarın altındaki fosforlu şerit yıkamadan sonra soyuldu.","Samet, Türkiye","Yes","No response"
"4","03/04/2025","N/A","misura ideale come bagaglio a mano per i voli, impermeabile e comodo da portare","Irene, Italy","Yes","No response"
"5","03/04/2025","Buen diseño","Buena capacidad","Zaira, Spain","Yes","No response"
"5","02/04/2025","ottimo zaino super comodo","super comodo per trekking e viaggi","Torrisi, Italy","Yes","No response"
"5","02/04/2025","Güzel","Çanta güzel yalnızca çok ses çıkarıyor kumaşından kaynaklı. Ama dış ortamlar için güzel.","Esranur, Türkiye","Yes","No response"
